file_name,uni,wylie,url,dept,grade,char_len,audio_len,path,inf
STT_CS-X-2015-M-D-B04-3-R-04_0102_1273010_to_1275047,ང་རྗེས་ལ་སླེབས་བསྡད་ཡོད། ག་རེ་བྱས་ན།  ,nga rjes la slebs bsdad yod/_ga re byas na/__,https://d38pmlk0v88drf.cloudfront.net/wav16k/STT_CS-X-2015-M-D-B04-3-R-04_0102_1273010_to_1275047.wav,STT_CS,3,38,2.037,wav16k/STT_CS-X-2015-M-D-B04-3-R-04_0102_1273010_to_1275047.wav,ང་རྒྱབ་ལ་སླེབས་བསྡད་ཡོད། ག་རེ་བྱས་ནས་ལབ་ན།
STT_CS-X-2015-P-D-B03-4-R-02_0002_21510_to_25230,གྷདཋྀ་ལ་འཛུལ་རེད་ད་ཡོད་བ། གྷདཋྀ་ཆེན་པོ་བྱས་རཱ།  ,g+hadaTh-i la 'dzul red da yod ba/_g+hadaTh-i chen po byas rA/__,https://d38pmlk0v88drf.cloudfront.net/wav16k/STT_CS-X-2015-P-D-B03-4-R-02_0002_21510_to_25230.wav,STT_CS,3,46,3.72,wav16k/STT_CS-X-2015-P-D-B03-4-R-02_0002_21510_to_25230.wav,གདཋྀ་ཅི་ལ་འཛུལ་རེད་ད་ཡོད་བ། གདཋྀ་ཆེན་པོ་བྱས་རཱ།
STT_AB00260_0139_1091009_to_1099803,ཏོག་ཙམ་ཡག་རུ་ཕྱིན་མི་ཡོང་། ཞེས་རང་ཉིད་ཀྱི་ཚོད་དཔག་དང་རེ་བ་བཤད་པས་ལྷག་རྡོར་གྱིས་སྐད་ཆ་དེ་དག་ཐོས་པས་ཅུང་ངོ་ཚ་བའི་སྣང་བ་བྱུང་།  ,tog tsam yag ru phyin mi yong /_zhes rang nyid kyi tshod dpag dang re ba bshad pas lhag rdor gyis skad cha de dag thos pas cung ngo tsha ba'i snang ba byung /__,https://d38pmlk0v88drf.cloudfront.net/wav16k/STT_AB00260_0139_1091009_to_1099803.wav,STT_AB,3,125,8.794,wav16k/STT_AB00260_0139_1091009_to_1099803.wav,ཏོག་ཙི་ཡག་རུ་ཕྱིན་མི་ཡོང་། ཞེས་རང་ཉིད་ཀྱི་ཚོད་དཔག་དང་རེ་བ་བཤད་པས་ལྷག་རྡོར་གྱིས་སྐད་ཆ་དེ་དག་ཐོས་རྗེས་ཅུང་ངོ་ཚ་བའི་སྣང་བ་བྱུང་།
STT_AB00260_0141_1113643_to_1117636,དམག་དཔོན་དེའི་མར་སེར་ཤ་འདྲ་བ་དེར་མི་མང་པོས་ཡིད་སྨོན་གྱིས་ལྟ་བཞིན་ཡོད།  ,dmag dpon de'i mar ser sha 'dra ba der mi mang pos yid smon gyis lta bzhin yod/__,https://d38pmlk0v88drf.cloudfront.net/wav16k/STT_AB00260_0141_1113643_to_1117636.wav,STT_AB,3,71,3.993,wav16k/STT_AB00260_0141_1113643_to_1117636.wav,དམག་དཔོན་དེའི་མར་སེར་ཤ་འདྲ་བ་དེར་མི་མང་པོས་ཡིད་སྨོན་གྱིས་ལྟ་བཞིན་ཡོད།
STT_AB00260_0142_1118353_to_1124923,དེ་ནས་དམག་དཔོན་དེས་མི་རྣམས་ལ་ལྟ་སྐབས་ཁ་ཤས་ནི་ཕོར་མར་རྒྱག་པ་དང་ཁ་ཤས་ནི་ངོ་ཚ་སྣང་ཆེན་པོས་ ,de nas dmag dpon des mi rnams la lta skabs kha shas ni phor mar rgyag pa dang kha shas ni ngo tsha snang chen pos _,https://d38pmlk0v88drf.cloudfront.net/wav16k/STT_AB00260_0142_1118353_to_1124923.wav,STT_AB,3,88,6.57,wav16k/STT_AB00260_0142_1118353_to_1124923.wav,དེ་ནས་དམག་དཔོན་དེས་མི་རྣམས་ལ་ལྟ་སྐབས་ཁ་ཤས་ནི་ཕོག་མར་རྒྱག་པ་དང་ཁ་ཤས་ནི་ངོ་ཚ་སྣང་ཆེན་པོས་
STT_AB00260_0117_887465_to_898848,ད་ཆ་མི་སུ་ཞིག་ལ་སོ་སོའི་གྲལ་རིམ་ལ་བསམ་བློ་མ་བཏང་བར། ལས་ཀ་འདི་དང་དེ་བྱེད་ཞེས་བྱེད་དགོས་དོན་ག་རེ་ཡིན་ནམ་ཞེས་ཤོད་ས་མེད་པ་མ་ཟད། ཐ་ན་དེ་སྔོན་ཞྭ་མོ་ཡོད་པ་དག་ཕུད་ ,da cha mi su zhig la so so'i gral rim la bsam blo ma btang bar/_las ka 'di dang de byed zhes byed dgos don ga re yin nam zhes shod sa med pa ma zad/_tha na de sngon zhwa mo yod pa dag phud _,https://d38pmlk0v88drf.cloudfront.net/wav16k/STT_AB00260_0117_887465_to_898848.wav,STT_AB,3,156,11.383,wav16k/STT_AB00260_0117_887465_to_898848.wav,ད་ཆ་མི་སུ་ཞིག་ལ་སོ་སོའི་གྲལ་རིམ་ལ་བསམ་བློ་མ་བཏང་བར་ལས་ཀ་འདི་དང་དེ་བྱེད་བཞེས་དགོས་དོན་ག་རེ་ཡིན་ནམ་ཞེས་ཤོད་ས་མེད་པ་མ་ཟད། ཐ་ན་དེ་སྔོན་ཞྭ་མོ་ཡོད་པ་དག་ཕུད།
STT_MV0331_0203_1557703_to_1567314,རང་ནང་ལ་ཡོང་བའི་ཐེངས་མ་དང་པོ་དེར། རེ་བ། རེ་བ། དགོངས་དག་ཞུ་དགོས་མྱི་དེ་ང་རེད། ཧ་ཅེ་ནང་ལ་ལོག་བྱས་དངུལ་སློང་མྱི་ཡིན་པ་ངས་ཧ་གོ་མ་བྱུང་།  ,rang nang la yong ba'i thengs ma dang po der/_re ba/_re ba/_dgongs dag zhu dgos myi de nga red/_ha ce nang la log byas dngul slong myi yin pa ngas ha go ma byung /__,https://d38pmlk0v88drf.cloudfront.net/wav16k/STT_MV0331_0203_1557703_to_1567314.wav,STT_MV,3,133,9.611,wav16k/STT_MV0331_0203_1557703_to_1567314.wav,རང་ནང་ལ་ཡོང་པ་ཐེངས་མ་དང་པོ་དེ། རེ་བ་རེད་བ། དགོངས་དག་ཞུ་དགོས་མྱི་དེ་ང་རེད། ཧའོ་ཇེ་ནང་ལ་ལོག་བྱས་དངུལ་སློག་མྱི་ཡིན་པ་ངས་ཧ་གོ་མ་བྱུང་། ཨ
STT_CS-X-2013-M-D-B02-3-R-03_0024_157322_to_162182,མུག་གཤེ་ཆགས་པ་གཅིག་སྤྲད། མུག་མུག་མུག་སྤྲད་སྙིང་བྲོ་སོང་ད།  ,mug gshe chags pa gcig sprad/_mug mug mug sprad snying bro song da/__,https://d38pmlk0v88drf.cloudfront.net/wav16k/STT_CS-X-2013-M-D-B02-3-R-03_0024_157322_to_162182.wav,STT_CS,3,59,4.86,wav16k/STT_CS-X-2013-M-D-B02-3-R-03_0024_157322_to_162182.wav,་ཆགས་པ་གཅིག་ྲ།སྤྲད་སྙིང་བྲོ་སོང་ད།
STT_NS_M0454_0288_1732261_to_1738796,ཆུ་ཚོད་དང་པོ་དང་ཕྱེད་ཀ་སི་ལ་ཁ་ལག་ཡོད་བ། དེ་ང་གི་འོག་ཁ་ཤས་ཅིག་ག་བྱེད་ཐུབ་མ་སོང་ད་རཱ་ཨོ་ད་འདིར་བཞག་བཞག་ཡིན་པ་ད་ཉིན་གུང་བརྒྱབ་ནས་བྱེད་དགོས་བསམ་སོང་བ།  ,chu tshod dang po dang phyed ka si la kha lag yod ba/_de nga gi 'og kha shas cig ga byed thub ma song da rA o da 'dir bzhag bzhag yin pa da nyin gung brgyab nas byed dgos bsam song ba/__,https://d38pmlk0v88drf.cloudfront.net/wav16k/STT_NS_M0454_0288_1732261_to_1738796.wav,STT_NS,3,148,6.535,wav16k/STT_NS_M0454_0288_1732261_to_1738796.wav,ཆུ་ཚོད་དང་པོ་དང་ཕྱེད་ཀ་སི་ལ་ཁ་ལག་ཡོད་བ། དེ་ང་གིས་འོག་ཁ་ཤས་ཤི་བྱེད་ཐུབ་མ་སོང་ད་རཱ། ཨོ་དེ་བཞག་བཞག་ཡིན་པ་ད་ཉག་པོ་བརྒྱབ་ནས་བྱེད་དགོས་བསམ་སོང་བ།
STT_NS_M0453_0417_2350401_to_2354360,ལྷ་མོ་ད་ཡོད་རཱ། ལྷ་མོ་རྒྱ་མཚན་ལབ་ནས་དེབ་འདྲ་བོ་མེད་རེད་བེ།  ,lha mo da yod rA/_lha mo rgya mtshan lab nas deb 'dra bo med red be/__,https://d38pmlk0v88drf.cloudfront.net/wav16k/STT_NS_M0453_0417_2350401_to_2354360.wav,STT_NS,3,60,3.959,wav16k/STT_NS_M0453_0417_2350401_to_2354360.wav,ལྷ་མོ་ད་ཡོད་རཱ། ལྷ་མོ་རྒྱ་མཚོ་ལབ་ན་དེབ་འདྲ་བོ་མེད་རེདེ།
STT_MV0100_0189_1310266_to_1315782,ངས་ཤེས་སོང་། ངས་ཐབས་ཤེས་བཏང་བྱས་ཁོ་པའི་རྩ་ནས་བདེན་པའི་མཐའ་གསལ་ཐུབ་པ་བྱེད་ཀི་ཡིན། ང་ལམ་སང་འགྲོ་གི་ཡིན།  ,ngas shes song /_ngas thabs shes btang byas kho pa'i rtsa nas bden pa'i mtha' gsal thub pa byed ki yin/_nga lam sang 'gro gi yin/__,https://d38pmlk0v88drf.cloudfront.net/wav16k/STT_MV0100_0189_1310266_to_1315782.wav,STT_MV,3,103,5.516,wav16k/STT_MV0100_0189_1310266_to_1315782.wav,ངས་ཤེས་སོང་། ངས་ཐབས་ཤེས་བཏང་བྱས་ཁོ་པའི་རས་ནས་བདེན་པའི་མཐའ་སེལ་ཐུབ་པ་བྱེད་ཀི་ཡིན། ང་ལམ་སང་འགྲོ་གི་ཡིན།
STT_MV0100_0190_1315782_to_1324913,མོ་རང་ནང་བཞིན་བུ་མོ་ཁ་རུ་ཁ་ཐུག་དེ་འདྲས་དངོས་གནས་དཀོན་པོ་རེད།  ,mo rang nang bzhin bu mo kha ru kha thug de 'dras dngos gnas dkon po red/__,https://d38pmlk0v88drf.cloudfront.net/wav16k/STT_MV0100_0190_1315782_to_1324913.wav,STT_MV,3,62,9.131,wav16k/STT_MV0100_0190_1315782_to_1324913.wav,མོ་རང་ནང་བཞིན་བུ་མོ་ཁ་རུ་ཁ་ཐུག་དེ་འདྲས་དངོས་གནས་དཀོན་པོ་རེད།
STT_AB00260_0121_933353_to_944689,སྐབས་ཤིག་རིང་ཀུང་ཧྲེའི་ལས་བྱེད་པ་རྣམས་གཤམ་སྐྱོད་དུ་འགྲོ་བའི་ལམ་ལུགས་བཟོས་ཏེ། རང་ཉིད་སྡོད་ཡུལ་གྱི་རུ་ཁག་ནས་རུ་ཁག་གཞན་དུ་འགྲོ་བ་དང་སྐར་ཆ་འཆད་ཀྱི་མེད་མོད། གོ་ཚུལ་ལྟར་ན།  ,skabs shig ring kung hre'i las byed pa rnams gsham skyod du 'gro ba'i lam lugs bzos te/_rang nyid sdod yul gyi ru khag nas ru khag gzhan du 'gro ba dang skar cha 'chad kyi med mod/_go tshul ltar na/__,https://d38pmlk0v88drf.cloudfront.net/wav16k/STT_AB00260_0121_933353_to_944689.wav,STT_AB,3,167,11.336,wav16k/STT_AB00260_0121_933353_to_944689.wav,སྐབས་ཤིག་རིང་ཀུང་ཧྲེའི་ལས་བྱེད་པ་རྣམས་གཤམ་སྐྱོད་དུ་འགྲོ་བའི་ལམ་ལུགས་བཟོས་ཏེ་རང་ཉིད་སྡོད་ཡུལ་གྱི་རུ་ཁག་ནས་རུ་ཁག་གཞན་དུ་འགྲོ་བ་དང་སྐར་ཆ་ཆད་ཀྱི་མེད་མོད། གུ་ཚོལ་ལྟར་ན་
STT_AB00260_0118_898848_to_910230,ཁོ་ཚོའི་ནང་ནས་མི་རེ་གཉིས་ཀྱིས་རང་གི་མདུན་དུ་གུས་གུས་ཞུམ་ཞུམ་བྱེད་པ་ཙམ་ལས་སྐྲག་མཁན་མེད་ལ། ད་དུང་མི་མང་པོ་ཞིག་གིས་རང་གི་མདུན་དུ་འདྲ་མཉམ་གྱི་སྐད་ཆ་ཤོད་པ་དང་། འདྲ་མཉམ་གྱི་ ,kho tsho'i nang nas mi re gnyis kyis rang gi mdun du gus gus zhum zhum byed pa tsam las skrag mkhan med la/_da dung mi mang po zhig gis rang gi mdun du 'dra mnyam gyi skad cha shod pa dang /_'dra mnyam gyi _,https://d38pmlk0v88drf.cloudfront.net/wav16k/STT_AB00260_0118_898848_to_910230.wav,STT_AB,3,168,11.382,wav16k/STT_AB00260_0118_898848_to_910230.wav,ཁོ་ཚོའི་ནང་ནས་མི་རེ་གཉིས་ཀྱིས་རང་གི་མདུན་དུ་གུས་གུས་ཞུམ་ཞུམ་བྱེད་པ་ཙམ་ལས་སྐྲག་མཁན་མེད་ལ་ད་དུང་མི་མང་པོ་ཞིག་གིས་རང་གི་མདུན་དུ་འདྲ་མཉམ་གྱི་སྐད་ཆ་ཤོད་པ་དང་འདྲ་མཉམ་གྱི་
STT_AB00260_0122_944689_to_956026,མང་ཚོགས་ཀྱིས་བསམ་འཆར་བཏོན་པ་ཕན་འབྲས་ཐོན་ནས་ཀུང་ཧྲེའི་འགོ་ཁྲིད་ཀྱང་རང་རང་སོ་སོའི་རུ་ཁག་ཏུ་བསྡད་དེ། ཁོ་ཚོ་ཡང་མང་ཚོགས་དང་མཉམ་དུ་ངལ་རྩོལ་ལ་འདྲ་འདྲ་ཐོན་དགོས་པ་མ་ཟད། ད་དུང་ ,mang tshogs kyis bsam 'char bton pa phan 'bras thon nas kung hre'i 'go khrid kyang rang rang so so'i ru khag tu bsdad de/_kho tsho yang mang tshogs dang mnyam du ngal rtsol la 'dra 'dra thon dgos pa ma zad/_da dung _,https://d38pmlk0v88drf.cloudfront.net/wav16k/STT_AB00260_0122_944689_to_956026.wav,STT_AB,3,167,11.337,wav16k/STT_AB00260_0122_944689_to_956026.wav,མང་ཚོགས་ཀྱིས་བསམ་འཆར་བཏོན་པར་ཕན་འབྲས་ཐོས་ནས་ཀུང་ཧྲེའི་འགོ་ཁྲིད་ཀྱང་རང་རང་སོ་སོའི་རུ་ཁག་ཏུ་བསྡད་དེ་ཁོ་ཚོ་ཡང་མང་ཚོགས་དང་མཉམ་དུ་ངལ་རྩོལ་ལ་འདྲ་འདྲ་ཐོན་དགོས་པ་མ་ཟད། ད་དུང་
STT_AB00260_0125_976501_to_984889,དང་ལོག་སྤྱོད་པ་དེ་ཚོར་ལས་ཀ་སྐུལ་བ་དང་ཁོ་ཚོའི་བྱེད་སྟངས་ལ་ལྟ་རྟོགས་བྱེད་པ་ལྟ་བུའི་སྣང་བ་ཡོང་གི་ཡོད་པས། མང་ཚོགས་ཀྱི་ཁྲོད་དུ་ངོ་ཚ་པོ་བྱུང་།  ,dang log spyod pa de tshor las ka skul ba dang kho tsho'i byed stangs la lta rtogs byed pa lta bu'i snang ba yong gi yod pas/_mang tshogs kyi khrod du ngo tsha po byung /__,https://d38pmlk0v88drf.cloudfront.net/wav16k/STT_AB00260_0125_976501_to_984889.wav,STT_AB,3,138,8.388,wav16k/STT_AB00260_0125_976501_to_984889.wav,དང་ལོག་སྤྱོད་པ་དེ་ཚོར་ལས་ཀ་བསྐུལ་བ་དང་ཁོ་ཚོའི་བྱེད་སྟངས་ལ་ལྟ་རྟོག་ཆེད་པ་ལྟ་བུའི་སྣང་བ་ཡོང་གི་ཡོད་པས་མང་ཚོགས་ཀྱི་ཁྲོད་དུ་ངོ་ཚ་པོ་བྱུང་།
STT_MV0100_0197_1377046_to_1386349,ཕྱེ་ལེབ་འཚེབ་དྲུབ་མའི་སེང་རས་དེ་ཚོ་རྦད་དེ་གཅིག་པ་རེད་ཤག གཅིག་པ་གཅིག་རྐྱང་རེད་ཤག གུས་པས་བསྡུར་བ་ཐེངས་མང་བྱས་པ་ཡིན།  ,phye leb 'tsheb drub ma'i seng ras de tsho rbad de gcig pa red shag_gcig pa gcig rkyang red shag_gus pas bsdur ba thengs mang byas pa yin/__,https://d38pmlk0v88drf.cloudfront.net/wav16k/STT_MV0100_0197_1377046_to_1386349.wav,STT_MV,3,115,9.303,wav16k/STT_MV0100_0197_1377046_to_1386349.wav,ཆེ་རེབས་འཚེམ་ཀྲུ་མས་གསང་རས་དེ་ཚོ་རྦད་དེ་གཅིག་པ་རེད་ཤག གཅིན་པ་གཅིག་རྐྱང་རེད་ཤག གུས་པས་འདུལ་བ་ཐེངས་མ་བྱས་པ་ཡིན།
STT_AB00260_0123_956026_to_967363,ཚོགས་འདུ་དང་། ལྟ་སྐོར། འཕྲལ་སྒྲུབ་སོགས་ཉུང་དུ་གཏོང་བའི་སྲིད་ཇུས་དོན་པ་དང་སྦྲགས། ལོ་དེར་རྫོང་དྲག་ཆས་པུའུ་ནས་བཏང་བའི་ལས་དོན་རུ་ཁག་གི་འགོ་ཁྲིད་དེས་ག་དུས་ཡིན་ན་ཡང་ལྷག་རྡོར་ལ་ ,tshogs 'du dang /_lta skor/_'phral sgrub sogs nyung du gtong ba'i srid jus don pa dang sbrags/_lo der rdzong drag chas pu'u nas btang ba'i las don ru khag gi 'go khrid des ga dus yin na yang lhag rdor la _,https://d38pmlk0v88drf.cloudfront.net/wav16k/STT_AB00260_0123_956026_to_967363.wav,STT_AB,3,171,11.337,wav16k/STT_AB00260_0123_956026_to_967363.wav,ཚོགས་འདུ་དང་། ལྟ་སྐོར། འཁྲལ་སྒྲུབ་སོགས་ཉུང་དུ་གཏོང་བའི་སྲིད་ཇུས་དོན་པ་དང་སྦྲགས། ལོ་དེར་རྫོང་དྲག་ཆས་ྤུའུ་ནས་བཏང་བའི་ལས་དོན་རུ་ཁག་གི་འགོ་ཁྲིད་དེས་ག་དུས་ཡིན་ནའང་ལྷག་རྡོར་ལ་
STT_MV0331_0206_1575462_to_1584839,ལས་ཀ་ག་རེ་བྱས་ནས་དོ་དོ་ཏན་ཏན་དང་། སེམས་པ་ལྷོད་ལ་བབས་བྱས། ད་ལྟ་ནང་བཞིན་བསྡད་ཀྱི་མ་རེད་བསམ་ཀི།  ,las ka ga re byas nas do do tan tan dang /_sems pa lhod la babs byas/_da lta nang bzhin bsdad kyi ma red bsam ki/__,https://d38pmlk0v88drf.cloudfront.net/wav16k/STT_MV0331_0206_1575462_to_1584839.wav,STT_MV,3,94,9.377,wav16k/STT_MV0331_0206_1575462_to_1584839.wav,ལས་ཀ་ག་རེ་བྱས་ནས། དོ་དོ་ཏན་ཏན་དང་སེམས་པ་ལྷོད་ལ་བབས་བྱས། ད་ལྟ་ནང་བཞིན་བསྡད་ཀི་མ་རེད་བསམ་གིས།
STT_MV0088_0043_294298_to_302782,ཀོང་ཇོ་མཆོག་ང་གོང་མ་མཆོག་གི་སྐུ་སྲུང་རུ་ཁག་ནང་བཞུགས་བྱས་མི་ཉག་རྒྱལ་ཁབ་ལ་ཕན་པའི་བྱ་བ་སྒྲུབ་འདོད་ཡོད། ཚེ་སྲོག་བློས་གཏོང་བྱེད་དགོས་བྱུང་ནས་ ,kong jo mchog nga gong ma mchog gi sku srung ru khag nang bzhugs byas mi nyag rgyal khab la phan pa'i bya ba sgrub 'dod yod/_tshe srog blos gtong byed dgos byung nas _,https://d38pmlk0v88drf.cloudfront.net/wav16k/STT_MV0088_0043_294298_to_302782.wav,STT_MV,3,137,8.484,wav16k/STT_MV0088_0043_294298_to_302782.wav,ཀོང་ཇོ་མཆོག ང་གོང་མ་མཆོག་གི་སྐུ་སྲུང་རུ་ཁང་ནང་བཞུགས་བྱས་ མི་ཉག་རྒྱལ་ཁབ་ལ་ཕན་པའི་བྱ་བ་སྒྲུབ་འདོད་ཡོད། ཚེ་སྲོག་བློས་གཏོང་བྱེད་དགོས་བྱུང་ནས།
STT_MV0100_0200_1404510_to_1414509,ད་ག་རང་རེད། ཡིན་ནས་རྫུ་མཁན་དེ་འཚེམ་སྟངས་གཅིག་པ་བྱས་པའི་སེང་རས་འདི་ག་འདྲས་སེ་བྱུང་པ་ཡིན་ན།  ,da ga rang red/_yin nas rdzu mkhan de 'tshem stangs gcig pa byas pa'i seng ras 'di ga 'dras se byung pa yin na/__,https://d38pmlk0v88drf.cloudfront.net/wav16k/STT_MV0100_0200_1404510_to_1414509.wav,STT_MV,3,91,9.999,wav16k/STT_MV0100_0200_1404510_to_1414509.wav,ད་ག་རང་རེད། ཡིན་ནས་རྫོ་རྒན་དེ་འཚེམ་མདངས་གཅིག་པ་བྱས་པའི་གསང་འབྲས་དེ་ག་འདྲས་སེ་བྱུང་པ་ཡིན་ན།
STT_CS-D-2014-M-D-B03-3-R-02_0052_441296_to_447902,དེ། སྐད་ཆེན་པོ་མ་རྒྱག ག་རེ་བྱེད་ཀི་ཡོད། ང་གཅིག་གཅིག་པོར། ང་བཅུ་ཆགས་སོང་བཅུ།  ,de/_skad chen po ma rgyag_ga re byed ki yod/_nga gcig gcig por/_nga bcu chags song bcu/__,https://d38pmlk0v88drf.cloudfront.net/wav16k/STT_CS-D-2014-M-D-B03-3-R-02_0052_441296_to_447902.wav,STT_CS,3,77,6.606,wav16k/STT_CS-D-2014-M-D-B03-3-R-02_0052_441296_to_447902.wav,སྐད་ཆེན་པོ་མ་རྒྱབ་ག་རེ་བྱེད་ཀྱི་ཡོད། ང་ནི་གྩིག་པོ། ང་བྱོ་ཞག།
STT_CS-D-2014-M-D-B03-3-R-02_0056_476496_to_479108,ང་ཚོ་ཨ་མ་ལགས་ནི་མིག་ནད་པ་རེད་ད་རཱ། ག་རེ།  ,nga tsho a ma lags ni mig nad pa red da rA/_ga re/__,https://d38pmlk0v88drf.cloudfront.net/wav16k/STT_CS-D-2014-M-D-B03-3-R-02_0056_476496_to_479108.wav,STT_CS,3,42,2.612,wav16k/STT_CS-D-2014-M-D-B03-3-R-02_0056_476496_to_479108.wav,ང་ཚོ་ཨ་མ་ལགས་ནི་མིག་ྣ་བ་རེད་ད་རཱ། ག་རེ།
STT_MV0100_0187_1297908_to_1307710,སྐུ་ངོ་པའོ་ལགས་ཀིས་གྱོད་གཞི་དེ་ཁོང་ལ་རྩད་ཞིབ་བྱེད་བཅུག་མ་བྱུང་གསུང་གི་འདུག་ཀ ང་ཚོས་དྲེ་ཧྲིང་ལ་ག་འདྲས་སེ་དྲི་དགོས་རེད། ད་ལྟ་ང་ཚོ་ཚང་མས་རྒྱལ་བདེན་གུང་གི་གཟིམ་ཤག་ལ་འགྲོ་ཐུབ་ཡ་ཡོད་མ་རེད། བྱས་ཙང་།  ,sku ngo pa'o lags kis gyod gzhi de khong la rtsad zhib byed bcug ma byung gsung gi 'dug ka_nga tshos dre hring la ga 'dras se dri dgos red/_da lta nga tsho tshang mas rgyal bden gung gi gzim shag la 'gro thub ya yod ma red/_byas tsang /__,https://d38pmlk0v88drf.cloudfront.net/wav16k/STT_MV0100_0187_1297908_to_1307710.wav,STT_MV,3,193,9.802,wav16k/STT_MV0100_0187_1297908_to_1307710.wav,སྐུ་ངོ་པའོ་ལགས་ཀིས་གྱོད་གཞི་དེ་ཁོང་ལ་རྩད་ཞིབ་བྱེད་བཅུག་མ་བྱུང་གསུང་གི་འདུག་ག ང་ཚོས་ཁྲེན་ཧྲིང་ལ་ག་འདྲས་སེ་འདྲི་དགོས་རེད། ད་ལྟ་ང་ཚོ་ཚང་མས་རྒྱལ་བྟེན་ཁུང་གི་གཟིམ་ཤག་ལ་འགྲོ་ཐུབ་ཡ་ཡོད་མ་རེད། བྱས་ཙང་
STT_MV0100_0195_1357580_to_1364450,སྐུ་ངོ་གིས་ཛ་ག་རེ་ཚོད་སོང་། སྐུ་ཤོགས་ཀུང་སུང་ལགས། ང་རང་གཉིས་ཀིས་གལ་ཆེའི་ཁུངས་སྣེ་གཅིག་ལྷོད་ཡངས་བཏང་ཤག ,sku ngo gis dza ga re tshod song /_sku shogs kung sung lags/_nga rang gnyis kis gal che'i khungs sne gcig lhod yangs btang shag_,https://d38pmlk0v88drf.cloudfront.net/wav16k/STT_MV0100_0195_1357580_to_1364450.wav,STT_MV,3,102,6.87,wav16k/STT_MV0100_0195_1357580_to_1364450.wav,སྐུ་ངོ་གིས་ཛ་ག་རེ་ཚོད་སོང་། སྐུ་ཤོགས་ཀུང་སུང་ལགས། ང་རང་གཉིས་ཀིས་གལ་ཆེའི་ཁུངས་སྣེ་གཅིག་ལྷོད་གཡེང་བཏང་ཤག
STT_MV0100_0199_1396348_to_1404510,རིགས་འདེད་བྱས་ན་ཕྱེ་ལེབ་སྔོན་པོ་གཉིས་པ་དེས་བརྫུས་བྱས་གྱོད་གཞི་བཟོས། ནང་ཀོང་གཡུད་ཧུའེ་ལ་ཡ་ལ་དཀྲི་རྩིས་བྱས་པ་རེད།  ,rigs 'ded byas na phye leb sngon po gnyis pa des brdzus byas gyod gzhi bzos/_nang kong g.yud hu'e la ya la dkri rtsis byas pa red/__,https://d38pmlk0v88drf.cloudfront.net/wav16k/STT_MV0100_0199_1396348_to_1404510.wav,STT_MV,3,113,8.162,wav16k/STT_MV0100_0199_1396348_to_1404510.wav,རིག་འདེག་བྱས་ན་ཆེ་ལེབ་སྔོན་པོ་གཉིས་པོ་དེ་རྫུས་བྱས་གྱོད་གཞི་གཙོས། ནང་ཀོང་གཡུད་ཧུའེ་ལ་ཡ་ལ་འཁྲིད་རྩིས་བྱས་པ་རེད།
STT_MV0100_0216_1512730_to_1516195,རང་ཁ་བཙན་པོ་ཡོད་པ་ང་ཡིད་ཆེས་ཀིས།  ,rang kha btsan po yod pa nga yid ches kis/__,https://d38pmlk0v88drf.cloudfront.net/wav16k/STT_MV0100_0216_1512730_to_1516195.wav,STT_MV,3,34,3.465,wav16k/STT_MV0100_0216_1512730_to_1516195.wav,རང་ཁ་བཙན་པོ་ཡོད་པ་ང་ཡིད་ཆེས་ཀིས།
