file_name,uni,wylie,url,dept,grade,char_len,audio_len,path,inf
STT_AB00259_0099_772380_to_777192,ད་ནི་རྒྱལ་ཁབ་ཀྱི་པ་ཕ་གྲོངས་དུས་གོད་ཆག་དང་འགྱུར་ལྡོག་མ་ཡོང་བ་ག་ལ་སྲིད་ཅེས་ཤོད་ཀི་ཡོད།  ,da ni rgyal khab kyi pa pha grongs dus god chag dang 'gyur ldog ma yong ba ga la srid ces shod ki yod/__,https://d38pmlk0v88drf.cloudfront.net/wav16k/STT_AB00259_0099_772380_to_777192.wav,STT_AB,3,86,4.812,wav16k/STT_AB00259_0099_772380_to_777192.wav,ད་ནི་རྒྱལ་ཁབ་ཀྱི་པ་ཕ་ཁྲུངས་དུས་གོད་ཆགས་དང་འགྱུར་ལྡོག་མ་ཡོང་བ་ག་ལ་སྲིད་ཅེས་ཤོད་ཀྱི་ཡོད།
STT_AB00259_0100_778711_to_780964,བུ་འཁྲིད་ཀིས་ཚེ་བརྟན་ལྷ་མོ་མཐོང་མ་ཐག་ ,bu 'khrid kis tshe brtan lha mo mthong ma thag _,https://d38pmlk0v88drf.cloudfront.net/wav16k/STT_AB00259_0100_778711_to_780964.wav,STT_AB,3,38,2.253,wav16k/STT_AB00259_0100_778711_to_780964.wav,བུ་ཁྲིད་ཀྱིས་ཚེ་བརྟན་ལྷ་མོ་མཐོང་མ་ཐག་
STT_PC0161_0500_3573523_to_3579189,ཉལ་ས་གྲུ་བཞི་དེའི་ནང་ལོགས་ལ་ཡ་ཆུ་ཚོད། བརྒྱད་ཙི་ཅིག་དེ་བ་རང་རྫོགས་པ་དང་། སོ་སོའི་བཟའ་ཚང་དེ་མཉམ་དུ་ལ་ཡ་མི་ཚེ་ཕྱེད་ཀ་ཅིག་སྐྱེལ་དགོས་རེད།  ,nyal sa gru bzhi de'i nang logs la ya chu tshod/_brgyad tsi cig de ba rang rdzogs pa dang /_so so'i bza' tshang de mnyam du la ya mi tshe phyed ka cig skyel dgos red/__,https://d38pmlk0v88drf.cloudfront.net/wav16k/STT_PC0161_0500_3573523_to_3579189.wav,STT_PC,3,135,5.666,wav16k/STT_PC0161_0500_3573523_to_3579189.wav,ཉི་རྩ་གྲུ་བཞི་དེའི་ནང་ལོགས་ལ་ཡ་ཆུ་ཚོད་བརྒྱལ་ཙི་ཅིག་དེ་བ་ར་རྫོགས་པ་དང་། སོ་སོའི་བཟའ་ཚང་དེ་མཉམ་དུ་ལ་ཡ་མི་ཚེ་ྐྱེད་ཀ་ཅིག་སྐྱེལ་དགོས་རེད།
STT_AB00259_0074_584701_to_593916,ཁོ་ཚོ་རྩམ་ཐུག་འཐུང་རྩིས་བྱེད་སྐབས་ཕུན་ཚོགས་ནི་འུ་ཐོམ་མེར་བསྡད་ནས། སྐད་ཆ་ཡང་མི་ཤོད་པ་དང་དེ་ནས་སླར་ཡང་དོན་དག་དེའི་སྐོར་གླེང་སྐབས་བློ་བཟང་གིས་ ,kho tsho rtsam thug 'thung rtsis byed skabs phun tshogs ni 'u thom mer bsdad nas/_skad cha yang mi shod pa dang de nas slar yang don dag de'i skor gleng skabs blo bzang gis _,https://d38pmlk0v88drf.cloudfront.net/wav16k/STT_AB00259_0074_584701_to_593916.wav,STT_AB,3,140,9.215,wav16k/STT_AB00259_0074_584701_to_593916.wav,ཁོ་ཚོ་བརྩམ་འཛུག་འཐུང་རྩིས་བྱེད་སྐབས་ཕུན་ཚོགས་ནི་འུ་འཐོམ་མེར་བསྡད་ནས་སྐད་ཆ་ཡང་མི་ཤོད་པ་དང་དེ་ནས་སླར་ཡང་དོན་དག་དེའི་སྐོར་གླེང་སྐབས་བློ་བཟང་གིས་
STT_AB00259_0080_613506_to_621322,དེ་འདྲས་བྱེད་དགོས་རྒྱུ་ག་རེ་ཡོད་རེད། རང་གི་ཕ་མ་སྤུན་མཆེད་གྲོངས་པ་ནི་མ་རེད་ཅེས་བཤད། ཚེ་བརྟན་ལྷ་མོ་ནི་པ་ཕའི་སྐད་ཆ་དེར་ཞེད་ཐག་ཆོད་ནས་ ,de 'dras byed dgos rgyu ga re yod red/_rang gi pha ma spun mched grongs pa ni ma red ces bshad/_tshe brtan lha mo ni pa pha'i skad cha der zhed thag chod nas _,https://d38pmlk0v88drf.cloudfront.net/wav16k/STT_AB00259_0080_613506_to_621322.wav,STT_AB,3,131,7.816,wav16k/STT_AB00259_0080_613506_to_621322.wav,དེ་འདྲས་བྱེད་དགོས་རྒྱུ་ག་རེ་ཡོད་རེད། རང་གི་ཕ་མ་སྤུན་མཆེད་གྲོངས་པ་ནི་མ་རེད་ཅེས་བཤད། ཚེ་བརྟན་ལྷ་མོ་ནི་པ་ཕའི་སྐད་ཆ་དེར་ཞེད་ཐག་ཆོད་ནས་
STT_MV0088_0307_2177516_to_2185951,རང་གི་རླུང་བཞོན་བཞོན་བྱས་དམག་སར་ཤོར་དུས་མི་ག་ཚོད་ཙམ་མི་ཤི་ཁྱིམ་སྟོང་ཆགས ,rang gi rlung bzhon bzhon byas dmag sar shor dus mi ga tshod tsam mi shi khyim stong chags_,https://d38pmlk0v88drf.cloudfront.net/wav16k/STT_MV0088_0307_2177516_to_2185951.wav,STT_MV,3,72,8.435,wav16k/STT_MV0088_0307_2177516_to_2185951.wav,རང་གིས་རླུང་བཞོན་བཞོན་བྱས་དམག་སར་ཤོར་དུས་མི་ག་ཚད་ཙམ་མི་ཤི་ཁྱིམ་སྟོང་ཆགས།
STT_MV0554_0102_681010_to_687346,ཧ་བོ་ཁག་པོ་བྱས་ཤག ངས་བྱས་ན། བྱས་ཙང་། སྡུག་ཉེན་ན་ངེད་གཉིས་ལ་ཅོ་འདྲི་བྱས་པ་ང་གཉིས་ལ། འདི། ཨོ་ཙི། བུ།  ,ha bo khag po byas shag_ngas byas na/_byas tsang /_sdug nyen na nged gnyis la co 'dri byas pa nga gnyis la/_'di/_o tsi/_bu/__,https://d38pmlk0v88drf.cloudfront.net/wav16k/STT_MV0554_0102_681010_to_687346.wav,STT_MV,3,100,6.336,wav16k/STT_MV0554_0102_681010_to_687346.wav,ཨའོ་ཁག་པོ་བྱས་ཤག ངས་བྱས་ན། བྱས་ཙང་། སྡུག་ཉས་ན་ངེད་གཉིས་ལ་ྐྱོག་དྲ་བྱས་པ་དེ། བྱས་ཙང་། ཨ་ཙི་བུ།
STT_MV0088_0311_2213926_to_2221169,ངས་རང་གི་བསམ་དོན་བསྒྲུབ་བཅུག་གི་མ་རེད། ངས་སྟོབས་ཤུགས་ཡོད་ཚད་བཏོན་བྱས་བཀག་འགོག་བྱེད་ཀི་ཡིན།  ,ngas rang gi bsam don bsgrub bcug gi ma red/_ngas stobs shugs yod tshad bton byas bkag 'gog byed ki yin/__,https://d38pmlk0v88drf.cloudfront.net/wav16k/STT_MV0088_0311_2213926_to_2221169.wav,STT_MV,3,92,7.243,wav16k/STT_MV0088_0311_2213926_to_2221169.wav,ངས་རང་གི་བསམ་དོན་སྒྲུབ་ཆོག་གི་མ་རེད། ངས་སྟོབས་ཤུགས་ཡོད་ཚད་བཏོན་བྱས་བཀག་འགོག་བྱེད་ཀི་ཡིན།
STT_MV0554_0106_709850_to_718788,བྱས་ཙང་། ཞེ་བོ་བྱེད་ཡ་གེ་མི་འདུག་ད། ད་བུ་གུ་དེས་ག་འདྲ་འདྲ་གཅིག་འཁྲིད་ཡོང་ན། ཡང་དེ་རིང་། བྱས་ཙང་། ད་ཁད་མཚར་དེ་འདྲ་འཁྲིད་ཡོང་ན། ང་ནི་དངོས་གནས་ཡ་ཁོ་རང་བྱེད་ཀི་མིན། ཨོ་ན་ཡིན་ན། བྱས་ཙང་།  ,byas tsang /_zhe bo byed ya ge mi 'dug da/_da bu gu des ga 'dra 'dra gcig 'khrid yong na/_yang de ring /_byas tsang /_da khad mtshar de 'dra 'khrid yong na/_nga ni dngos gnas ya kho rang byed ki min/_o na yin na/_byas tsang /__,https://d38pmlk0v88drf.cloudfront.net/wav16k/STT_MV0554_0106_709850_to_718788.wav,STT_MV,3,183,8.938,wav16k/STT_MV0554_0106_709850_to_718788.wav,བྱས་ཙང་། ཞེ་བོ་བྱེད་ཡ་གེ་མི་འདུག་ད། ད་པུ་གུ་འདི་ག་འདྲས་ཅིག་འཁྲིད་ཡོང་ན་རེད། ཡང་དི་ག། བྱས་ཙང་། ད་ཁྱད་མཚར་ཨེ་འདྲས་འཁྲིད་ཡོང་ན། ང་ནི་དངོས་གནས་ཡག་ཁོ་རང་བྱེད་ཀི་མིན། འོ་ནས་ནི། བྱས་ཙང
STT_NS_M0491_0308_2048422_to_2051707,རོགས་པ་བྱེད་ཡ་ཐབས་ཤེས་བྱེད་ཡ་དང་ཨེ་ནས་ཆོབ་ཡང་ཚ་བོ་འདྲ་བོ་ཡོད་རེད་ཡོད་བ།  ,rogs pa byed ya thabs shes byed ya dang e nas chob yang tsha bo 'dra bo yod red yod ba/__,https://d38pmlk0v88drf.cloudfront.net/wav16k/STT_NS_M0491_0308_2048422_to_2051707.wav,STT_NS,3,73,3.285,wav16k/STT_NS_M0491_0308_2048422_to_2051707.wav,རོགས་པ་བྱེད་ཡ་ཐབས་ཤེས་བྱེད་ཡ་དང་ཨེ་ནས་ཆོབ་ཡང་ཚ་བོ་འདྲ་བོ་ཡོད་རེད་ཡོད་བ།
STT_AB00259_0083_633711_to_645895,སྤོ་བོ་ལགས། ངས་བཤད་མི་ཡོང་། ངས་བཤད་མི་ཡོང་ཞེས་བཤད། ཕུན་ཚོགས་ཀྱིས་གློ་བུར་དུ་སྦི་ལ་གསང་པོས་ད་ཁ་ཁ་བསྡད་ན་མ་གཏོགས་མཚན་མོར་སྐོར་གཡེང་རྒྱག་མཁན་ཡོད་རེད་ད་ཞེས་བཤད་པ་ ,spo bo lags/_ngas bshad mi yong /_ngas bshad mi yong zhes bshad/_phun tshogs kyis glo bur du sbi la gsang pos da kha kha bsdad na ma gtogs mtshan mor skor g.yeng rgyag mkhan yod red da zhes bshad pa _,https://d38pmlk0v88drf.cloudfront.net/wav16k/STT_AB00259_0083_633711_to_645895.wav,STT_AB,3,159,12.184,wav16k/STT_AB00259_0083_633711_to_645895.wav,སྤོ་བོ་ལགས། ངས་བཤད་མི་ཡོང་། ངས་བཤད་མི་ཡོང་ཞེས་བཤད། ཕུན་ཚོགས་ཀྱིས་གློ་བུར་དུ་སྦི་ལ་བཟང་པོས་ད་ཁ་ཁ་བསྡད་ན་མ་གཏོགས་མཚན་མོ་སྐོར་གཡེན་རྒྱག་མཁན་ཡོད་རེད་ད་ཞེས་བཤད་པ་
STT_PC0161_0515_3659862_to_3662710,དང་དུ་ལེན་ཐུབ་ཡ་ཅིག་བྱེད་ཀི་ཡིན་བསམ་ཡ་གི་སྙིང་སྟོབས་སྐྱེད་དང་དེ་འགྲིག་བསྡད་ཡོད་རེད།  ,dang du len thub ya cig byed ki yin bsam ya gi snying stobs skyed dang de 'grig bsdad yod red/__,https://d38pmlk0v88drf.cloudfront.net/wav16k/STT_PC0161_0515_3659862_to_3662710.wav,STT_PC,3,85,2.848,wav16k/STT_PC0161_0515_3659862_to_3662710.wav,དང་དུ་ལེན་ཐུབ་ཡ་ཅིག་བྱེད་ཀི་ཡིན་བསམ་ཡ་གི་སྙིང་སྟོབས་སྐྱེས་དང་ དེ་འགྲིག་བསྡད་ཡོད་རེད།
STT_PC0161_0517_3678223_to_3680527,ཨེ་ནས་ཚང་མ་བཀའ་དྲིན་ཆེ། སེམས་གཏིང་ནས་ཐུགས་ཆེ་གནང་ཞུ་གི་ཡིན།  ,e nas tshang ma bka' drin che/_sems gting nas thugs che gnang zhu gi yin/__,https://d38pmlk0v88drf.cloudfront.net/wav16k/STT_PC0161_0517_3678223_to_3680527.wav,STT_PC,3,61,2.304,wav16k/STT_PC0161_0517_3678223_to_3680527.wav,ཨེ་ནས་ཚང་མ་བཀའ་དྲིན་ཆེ། སེམས་གཏིང་ནས་ཐུགས་ྗེ་གནང་ཞུ་གི་ཡིན།
STT_PC0161_0519_3688303_to_3690383,མི་བདུན་བརྒྱ་བརྒྱད་བརྒྱ་གཅིག་གིས་དངོས་སུ་ཡང་ཨེ་ནས་ང་ལ།  ,mi bdun brgya brgyad brgya gcig gis dngos su yang e nas nga la/__,https://d38pmlk0v88drf.cloudfront.net/wav16k/STT_PC0161_0519_3688303_to_3690383.wav,STT_PC,3,56,2.08,wav16k/STT_PC0161_0519_3688303_to_3690383.wav,མི་བདུན་བརྒྱ་བརྒྱད་བརྒྱད་ཅིག་གིས་དངོས་སུ་ཡ་ཨེ་ནས་ང་ལ།
STT_PC0161_0520_3691343_to_3693359,ཨེ་ནས་འདུག་སེ་བྱས་མིག་གཉིས་ཀིས་ང་ལ་བལྟས། སེམས།  ,e nas 'dug se byas mig gnyis kis nga la bltas/_sems/__,https://d38pmlk0v88drf.cloudfront.net/wav16k/STT_PC0161_0520_3691343_to_3693359.wav,STT_PC,3,48,2.016,wav16k/STT_PC0161_0520_3691343_to_3693359.wav,ཨེ་ནས་འདུག་སེ་བྱས། མིག་གཉིས་ཀིས་ང་ལ་བལྟས། སེམས།
STT_PC0161_0525_3740260_to_3742660,མི་ཚེ་ཟེར་ཡ་འདི་ལེ་ཚེ་ཅིག་སྡོམ་ཚིག་བརྒྱབ་ཐུབ་པ་དང་།  ,mi tshe zer ya 'di le tshe cig sdom tshig brgyab thub pa dang /__,https://d38pmlk0v88drf.cloudfront.net/wav16k/STT_PC0161_0525_3740260_to_3742660.wav,STT_PC,3,53,2.4,wav16k/STT_PC0161_0525_3740260_to_3742660.wav,མི་ཚེ་ཟེར་ཡ་འདི་ལེས་ཙི་ཅིག་སྡོམ་ཚག་བསྐྱབ་ཐུབ་པ་ད།
STT_PC0161_0526_3751300_to_3754404,དགའ་རོགས་མེད་ན་ཡང་སོ་སོས་ད་ལྟ་ཡོད་པའི་དངོས་པོ་དེ་ཚོ་བེད་སྤྱོད་ཡག་པོ་བཏང་ཐུབ།  ,dga' rogs med na yang so sos da lta yod pa'i dngos po de tsho bed spyod yag po btang thub/__,https://d38pmlk0v88drf.cloudfront.net/wav16k/STT_PC0161_0526_3751300_to_3754404.wav,STT_PC,3,78,3.104,wav16k/STT_PC0161_0526_3751300_to_3754404.wav,དགའ་རོགས་མེད་ན་ཡང་སོ་སོ་ད་ལྟ་ཡོད་པའི་དངོས་པོ་དེ་ཚོ་བེད་སྤྱོད་ཡག་པོ་བཏང་ཐུབ།
STT_PC0161_0530_3783925_to_3786645,བྱེད་འདོད་ཡོད་པ་དང་། སོ་སོ་དགའ་ཕྱོགས་ཡོད་པའི་ལས་ཀ་དེ་ཚོ་མུ་མཐུད་ནས་བྱས།  ,byed 'dod yod pa dang /_so so dga' phyogs yod pa'i las ka de tsho mu mthud nas byas/__,https://d38pmlk0v88drf.cloudfront.net/wav16k/STT_PC0161_0530_3783925_to_3786645.wav,STT_PC,3,73,2.72,wav16k/STT_PC0161_0530_3783925_to_3786645.wav,བྱེད་འདོད་ཡོད་པ་དང་སོ་སོ་དགའ་ཕྱོགས་ཡོད་པའི་ལས་ཀ་དེ་ཚོ་མུ་མཐུད་ནས་བྱས།
STT_PC0161_0531_3789077_to_3792629,ད་སྐྱེ་བ་གཞུག་མ་ཟེར་ཡ་ཅིག མི་ཚེ་ཟེར་ཡ་ཅིག ཨེ་འདྲས་འདྲ་བོ་ཅིག་གི་ལུས་རྟེན་ཅིག་ཐུབ་ཡ་དེ་ད།  ,da skye ba gzhug ma zer ya cig_mi tshe zer ya cig_e 'dras 'dra bo cig gi lus rten cig thub ya de da/__,https://d38pmlk0v88drf.cloudfront.net/wav16k/STT_PC0161_0531_3789077_to_3792629.wav,STT_PC,3,90,3.552,wav16k/STT_PC0161_0531_3789077_to_3792629.wav,ད་སྐྱེ་བ་གཞུག་མ་ཟེར་ཡ་ཅིག་མི་ཚེ་ཟེར་ཡ་ཅིག ཨེ་འདྲའི་འདྲ་བོ་ཅིག་གི་ལུས་རྟེན་ཅིག་ཐུག་ཡ་དེ་ད།
STT_AB00259_0084_646100_to_652602,མཇུག་མ་སྒྲིལ་གོང་ཐོག་ཁའི་སྟེང་ནས་ཚག་སྒྲ་གྲགས་ཡོང་བས་ཚེ་བརྟན་ལྷ་མོས་ཁ་རོག་སྡོད་དགོས་པའི་ལག་བརྡ་བྱས།  ,mjug ma sgril gong thog kha'i steng nas tshag sgra grags yong bas tshe brtan lha mos kha rog sdod dgos pa'i lag brda byas/__,https://d38pmlk0v88drf.cloudfront.net/wav16k/STT_AB00259_0084_646100_to_652602.wav,STT_AB,3,100,6.502,wav16k/STT_AB00259_0084_646100_to_652602.wav,མཇུག་མ་བསྒྲིལ་གོང་ཐོག་ཁའི་སྟེང་ནས་ཚ་སྒྲ་གྲགས་ཡོང་བས་ཚེ་བརྟན་ལྷ་མོས་ཁ་རོགས་སྡོད་དགོས་པའི་ལག་བརྟ་བྱས།
STT_PC0161_0509_3623967_to_3630742,རང་བཞིན་ཁོ་རང་ད་ག་རེད། ད་དེ་ལ་འགྱུར་ལྡོག་གཏོང་ཡ་ཡོད་མ་རེད། བསམ་བློ་བཏང་ཡ་སྡུག་དྲག་པ་མ་རེད། སོ་སོས་བཏང་སྟངས་མ་འགྲིག་པ་མ་རེད།  ,rang bzhin kho rang da ga red/_da de la 'gyur ldog gtong ya yod ma red/_bsam blo btang ya sdug drag pa ma red/_so sos btang stangs ma 'grig pa ma red/__,https://d38pmlk0v88drf.cloudfront.net/wav16k/STT_PC0161_0509_3623967_to_3630742.wav,STT_PC,3,125,6.775,wav16k/STT_PC0161_0509_3623967_to_3630742.wav,རང་བཞིན་ཁོ་རང་ད་ག་རེད། ད་དེ་ལ་འགྱུར་ལྡོག་གཏུབ་ཡ་ཡོད་མ་རེད། བསམ་བློ་གཏང་ཡ་སྡུག་དྲགས་པ་མ་རེད། སོ་སོས་བཏང་སྟངས་མ་འགྲིག་པ་མ་རེད།
STT_AB00259_0096_745315_to_756766,ཉིན་ཤས་དེའི་རིང་མི་རྣམས་ངལ་རྩོལ་དུ་འགྲོ་སྐབས་ཡིན་ན་ཡང་འདྲ། ཡང་ན་ཁྱིམ་ཚང་ནང་དུ་སྡོད་སྐབས་ཡིན་ན་ཡང་འདྲ། གང་ལྟར་གནས་ཚུལ་དེའི་སྐོར་གླེང་གི་ཡོད་ཅིང་། ཁོ་ཚོས་དེ་སྔོན་ལག་ཏུ་ནོར་བུའི་དཔེ་དེབ་ཁེར་ནས་ ,nyin shas de'i ring mi rnams ngal rtsol du 'gro skabs yin na yang 'dra/_yang na khyim tshang nang du sdod skabs yin na yang 'dra/_gang ltar gnas tshul de'i skor gleng gi yod cing /_kho tshos de sngon lag tu nor bu'i dpe deb kher nas _,https://d38pmlk0v88drf.cloudfront.net/wav16k/STT_AB00259_0096_745315_to_756766.wav,STT_AB,3,191,11.451,wav16k/STT_AB00259_0096_745315_to_756766.wav,ཉིན་ཤས་དེའི་རིང་མི་རྣམས་ངལ་རྩོལ་དུ་འགྲོ་སྐབས་ཡིན་ནཡང་འདྲ། ཡང་ན་ཁྱིམ་ཚང་ནང་དུ་སྡོད་སྐབས་ཡིན་ན་ཡང་འདྲ། གང་ལྟར་གནས་ཚུལ་དེའི་སྐོར་གལེན་གི་ཡོད་ཅིང་། ཁོ་ཚོས་དེ་སྔོན་ལག་ཏུ་ནོར་བུའི་དཔེ་དེབ་ཁྱེར་ནས་
STT_MV0088_0313_2232625_to_2238298,བྱས་ཙང་ང་བལྟ་སེ་བྱེད་ཀ་འགྲོ་གི་ཡིན། ཁོ་དུ་ཆང་ནང་བཞིན་ཇག་པ་ཆགས་པ་རེད་པེ། མ་རེད།  ,byas tsang nga blta se byed ka 'gro gi yin/_kho du chang nang bzhin jag pa chags pa red pe/_ma red/__,https://d38pmlk0v88drf.cloudfront.net/wav16k/STT_MV0088_0313_2232625_to_2238298.wav,STT_MV,3,80,5.673,wav16k/STT_MV0088_0313_2232625_to_2238298.wav,བྱས་ཙང་ང་ལྟ་ཙེ་བྱེད་ཀ་འགྲོ་གི་ཡིན། ཁོ་དུ་ཆང་ནང་བཞིན་ཇག་པ་ཆགས་པ་རེད་པེ། མ་རེད།
STT_MV0601_0258_1575661_to_1584004,ཡིན་ནས་གྲོགས་པོའི་ལ་རྒྱ་རི་བརྒྱ་ལྷུན་པོ་ནང་བཞིན་འགྱུར་བ་མེད་པར་ཤོག བྱས་ཙང་། མི་ཚེ་མཚོན་ཆེད་ཀི་ ,yin nas grogs po'i la rgya ri brgya lhun po nang bzhin 'gyur ba med par shog_byas tsang /_mi tshe mtshon ched ki _,https://d38pmlk0v88drf.cloudfront.net/wav16k/STT_MV0601_0258_1575661_to_1584004.wav,STT_MV,3,95,8.343,wav16k/STT_MV0601_0258_1575661_to_1584004.wav,ངད་གཉིས་གྲོགས་པོའི་ལག་རྒྱ་དིས་རྒྱལ་ལ་རླུང་པ་ལབ་བྱས་འགྱུར་བ་ཡོད་པར་ཤོག བྱས་ཙང་། ངས་སེམ་པའི་མཚོན་ཆས་ཁྱ་
STT_MV0100_0057_432170_to_433257,ནང་ཀོང་གཡུད་ཧུའེ་བསད།  ,nang kong g.yud hu'e bsad/__,https://d38pmlk0v88drf.cloudfront.net/wav16k/STT_MV0100_0057_432170_to_433257.wav,STT_MV,3,23,1.087,wav16k/STT_MV0100_0057_432170_to_433257.wav,ནང་ཀོང་གཡུད་ཧུའེ་བསད།
STT_MV0100_0058_433257_to_434508,དེ་ནས་ངར་ཞྭ་མོ་གཡོགས་པ་རེད།  ,de nas ngar zhwa mo g.yogs pa red/__,https://d38pmlk0v88drf.cloudfront.net/wav16k/STT_MV0100_0058_433257_to_434508.wav,STT_MV,3,29,1.251,wav16k/STT_MV0100_0058_433257_to_434508.wav,དེ་ནས་ང་ཞྭ་མོ་གཡོགས་པ་རེད།
STT_MV0100_0060_437657_to_440269,ཕྱིས་འབྱུང་ད་དུང་ང་ཚོར་རྙོག་དྲ་ག་རེ་ཡོད་མེད་ཤེས་མ་སོང་།  ,phyis 'byung da dung nga tshor rnyog dra ga re yod med shes ma song /__,https://d38pmlk0v88drf.cloudfront.net/wav16k/STT_MV0100_0060_437657_to_440269.wav,STT_MV,3,57,2.612,wav16k/STT_MV0100_0060_437657_to_440269.wav,ཕྱིན་བྱུང་ད་དུང་ང་ཚོར་རྙོག་དྲ་ག་རེ་ཡོང་གི་ཡོད་མེད་ཤེས་མ་སོང་།
STT_MV0100_0064_464356_to_471247,ནང་ཀོང་ཆུའེ་གསུམ་ཡོད་ནའང་ང་ཚོ་གླགས་ཁེལ་གི་མ་རེད། ང་ད་ལྟ་རང་དང་དེའི་སྐོར་བཤད་འདོད་མི་འདུག ང་གཙོ་བོ་དེ་ ,nang kong chu'e gsum yod na'ang nga tsho glags khel gi ma red/_nga da lta rang dang de'i skor bshad 'dod mi 'dug_nga gtso bo de _,https://d38pmlk0v88drf.cloudfront.net/wav16k/STT_MV0100_0064_464356_to_471247.wav,STT_MV,3,102,6.891,wav16k/STT_MV0100_0064_464356_to_471247.wav,ནང་ཀུང་ཆུའེ་གསུམ་ཡོད་ན་ང་ཚོ་ལག་ཁེལ་གི་མ་རེད། ང་ད་ལྟ་རང་དང་དིའི་སྐོར་བཤད་འདོད་མི་འདུག ང་གཙོ་བོ་དེ་
STT_MV0088_0314_2238298_to_2247514,ཁོ་ཇག་པ་ཆགས་ཡོད་མ་རེད་ལ་གཡུད་ཤང་ཧཡེ་མཉམ་དུ་བསྡད་མི་འདུག ཁོ་གཡུ་ཤང་ཧཡེ་གི་རྟ་ཤོག་གི་གྲོགས་པོ་བློས་ཐུབ་རེད། གཅིག་བྱས་ན་ཁོས་གཡུད་ཤང་ཧཡེ་གི་གནས་ཚུལ་ཤེས་མདོག་ཁ་པོ་རེད། བྱས་ན་ཡག་ཤོས་ཡིན།  ,kho jag pa chags yod ma red la g.yud shang haye mnyam du bsdad mi 'dug_kho g.yu shang haye gi rta shog gi grogs po blos thub red/_gcig byas na khos g.yud shang haye gi gnas tshul shes mdog kha po red/_byas na yag shos yin/__,https://d38pmlk0v88drf.cloudfront.net/wav16k/STT_MV0088_0314_2238298_to_2247514.wav,STT_MV,3,182,9.216,wav16k/STT_MV0088_0314_2238298_to_2247514.wav,ཁོ་ཇག་པ་ཆགས་ཡོད་མ་རེད་ལ། གཡུད་ཞང་ཧེ་མཉམ་དུ་བསྡད་མི་འདུག ཁོས་གཡུད་ཞན་ཧའེ་གི་ལྟ་ཤོག་གི་གྲོགས་པོ་བློ་ཐུབ་རེད། གཅིག་བྱས་ན་ཁོས་གཡུད་ཞན་ཧེ་གི་གནས་ཚུལ་ཤེས་མདོག་ཁ་པོ་རེད། བྱས་ན་ཡག་ཤོས་ཡིན།
