file_name,uni,wylie,url,dept,grade,char_len,audio_len,path,inf
STT_PC0162_0150_798326_to_805878,ཁ་ཤས་ངས་ཁ་སང་ཞུས་པ་ཡིན་པ་ཡིན་པ། ང་ཚོ་ད་ལྟ་བོད་རིགས་དེ་འདྲས་ལ་ཡ་སྤོ་རྨོ་དེ་འདྲས་ཆོས་པ་ཡིན་ཟེར་ཞེ་བོ་ཅིག་ཕར་ཁ་ནས་སྙིང་རྗེ་དང་བྱམས་བརྩེ་མ་གཏོགས་སྐད་ཆ་མ་བཤད།  ,kha shas ngas kha sang zhus pa yin pa yin pa/_nga tsho da lta bod rigs de 'dras la ya spo rmo de 'dras chos pa yin zer zhe bo cig phar kha nas snying rje dang byams brtse ma gtogs skad cha ma bshad/__,https://d38pmlk0v88drf.cloudfront.net/wav16k/STT_PC0162_0150_798326_to_805878.wav,STT_PC,3,155,7.552,wav16k/STT_PC0162_0150_798326_to_805878.wav,ཁ་ཤས་ངས་ཁ་སང་ཞུས་པ་ཡིན་པ་ཡིན་པ། ང་ཚོ་ད་ལྟ་བོད་རིགས་དེ་འདྲས་ལ་ཡ་སྤོས་རྨོ་དེ་འདྲས་ཆོད་པ་ཡིན་ཟེ་ཞེ་བོ་ཅིག་ཕར་ཁ་ནས་སྙིང་རྗེ་དང་བཞམས་བརྩེ་མ་གཏོགས་སྐད་ཆ་མ་བཤད།
STT_AB00260_0153_1190452_to_1198651,དེ་ནས་མི་གཞན་དག་སྤགས་ཟ་དུས་མཉམ་དུ་སྤགས་ཆེ་ཐག་ཆོད་ཅིག་ཟས་བྱས། རྩམ་པ་འགམ་པ་དེ་དག་རྩིས་མེད་དུ་གཏོང་གི་ཡོད་རེད། ཅེས་བཤད་པར་དེ་ལ་རྒྱུ་མཚན་འདུག་ ,de nas mi gzhan dag spags za dus mnyam du spags che thag chod cig zas byas/_rtsam pa 'gam pa de dag rtsis med du gtong gi yod red/_ces bshad par de la rgyu mtshan 'dug _,https://d38pmlk0v88drf.cloudfront.net/wav16k/STT_AB00260_0153_1190452_to_1198651.wav,STT_AB,3,139,8.199,wav16k/STT_AB00260_0153_1190452_to_1198651.wav,དེ་ནས་མི་གཞན་དག་སྤགས་ཟ་དུས་མཉམ་དུ་སྤགས་ཆེ་ཐག་ཆོད་ཅིག་བཟས་བྱས་རྩམ་པ་སྒང་པ་དེ་རྩིས་མེད་གཏང་གི་ཡོད་རེད་ཅེས་བཤད་པར་དེ་ལ་རྒྱུ་མཚན་འདུག་
STT_AB00260_0152_1180418_to_1190332,ཡིན་ནས་ཕོ་ཐ་མས་རྐུབ་ས་ལ་བཙུགས་མ་ཐག་ཇ་ཕོར་དང་རྩམ་སྒྱེ་དུས་གཅིག་ཏུ་བཏོན་རྗེས། རྩམ་པ་དེ་པུས་མོའི་འཁྲིས་ལ་ཡ་བཞག་བྱས། ཇ་འཐུང་གིན་རྩམ་པ་འགམ་གྱིན་བྱེད་པ་དང་།  ,yin nas pho tha mas rkub sa la btsugs ma thag ja phor dang rtsam sgye dus gcig tu bton rjes/_rtsam pa de pus mo'i 'khris la ya bzhag byas/_ja 'thung gin rtsam pa 'gam gyin byed pa dang /__,https://d38pmlk0v88drf.cloudfront.net/wav16k/STT_AB00260_0152_1180418_to_1190332.wav,STT_AB,3,152,9.914,wav16k/STT_AB00260_0152_1180418_to_1190332.wav,ཡིན་ནས་ཕོ་མཐའ་མས་རྐུབ་ས་ལ་བཙུགས་མ་ཐག་ཇ་ཕོར་དང་རྩམ་སྐྱ་དུས་གཅིག་ཏུ་བཏོན་བྱས་རྩམ་པ་དེས་པུས་མོའི་འཁྲིས་ལ་ཡ་བཞག་བྱས་ཇ་འཐུང་གིན་རྩམ་པ་སྒམ་གྱིན་བྱེད་པ་དང་།
STT_CS-X-2013-M-D-B05-4-R-02_0028_234521_to_240646,རྩེད་མོ་རྩེ་རྩེ་བསྡེ་བསྡད་ཡིན་ད་རཱ། ཨེ་ནས་སྨན་ཁང་ལ་ཏག་ཏག་ཁོ་རང་སྐད་བཏང་སོང་ད་རཱ། ང་རཱ། ཨེ་ནས་སྨན་ཁང་ལ་འགྲོ་ཡིན་ད་རཱ། ལྷག་པ་ཆོས་སྐྱིད།  ,rtsed mo rtse rtse bsde bsdad yin da rA/_e nas sman khang la tag tag kho rang skad btang song da rA/_nga rA/_e nas sman khang la 'gro yin da rA/_lhag pa chos skyid/__,https://d38pmlk0v88drf.cloudfront.net/wav16k/STT_CS-X-2013-M-D-B05-4-R-02_0028_234521_to_240646.wav,STT_CS,3,135,6.125,wav16k/STT_CS-X-2013-M-D-B05-4-R-02_0028_234521_to_240646.wav,རྩེད་མོ་རྩེ་རྩེ་རྩེ་བསྡད་ཡིན་ད་རཱ། ཨ་ནས་སྨན་ཁང་ལ་ཏ་ཏག་ཏག་ཁོ་རང་སྐད་བཏང་སོང་ད་རཱ། ང་རཱ། ཨ་ནས་སྨན་ཁང་ལ་འགྲོ་ཡིན་ད་རཱ། རྷག་པ་ཆེ།
STT_MV0101_0066_484333_to_491226,ངས་དཔང་རྟགས་བལྟས་བྱས། གྱོད་གཞི་རྩད་གཅོད་བྱེད་པ་ཞེད་ཡ་ག་རེ་འདུག ཡིན་ནས། ཨའེ་ཧོས།  ,ngas dpang rtags bltas byas/_gyod gzhi rtsad gcod byed pa zhed ya ga re 'dug_yin nas/_a'e hos/__,https://d38pmlk0v88drf.cloudfront.net/wav16k/STT_MV0101_0066_484333_to_491226.wav,STT_MV,3,81,6.893,wav16k/STT_MV0101_0066_484333_to_491226.wav,ངས་དཔང་རྟགས་ལ་བལྟས་བྱས་གྱོད་གཞི་རྩད་གཅོད་བྱས་པ་ཞེད་ཡ་ག་རེ་འདུག ཡིན་ནས། ཨའེ་ཧོས།
STT_MV0101_0067_491226_to_498749,གལ་སྲིད་རང་རོགས་པ་བྱེད་འདོད་ཡོད་ན་སྔོན་ལ་རང་གིས་རྒྱལ་བདེན་གུང་གིས་གཟིམ་ཤག་ནང་ལ་དོགས་པ་ཡོད་པ་སུ་འདུག་བསམ་བློ་གཏོང་།  ,gal srid rang rogs pa byed 'dod yod na sngon la rang gis rgyal bden gung gis gzim shag nang la dogs pa yod pa su 'dug bsam blo gtong /__,https://d38pmlk0v88drf.cloudfront.net/wav16k/STT_MV0101_0067_491226_to_498749.wav,STT_MV,3,116,7.523,wav16k/STT_MV0101_0067_491226_to_498749.wav,གལ་སྲིད་རང་རོགས་པ་བྱེད་འདོད་ཡོད་ན། སྔོན་ལ་རང་གིས་རྒལ་བདེན་གུང་གི་གཟིམ་ཤག་ནང་ལ་དོགས་པ་ཡོད་པ་སུ་འདུག་བསམ་བློ་གཏོང་།
STT_MV0101_0068_498749_to_501458,སང་ཉིན་རང་ང་མཉམ་དུ་འགྲོ་དུས་ ,sang nyin rang nga mnyam du 'gro dus _,https://d38pmlk0v88drf.cloudfront.net/wav16k/STT_MV0101_0068_498749_to_501458.wav,STT_MV,3,29,2.709,wav16k/STT_MV0101_0068_498749_to_501458.wav,སང་ཉིན་རང་ང་མཉམ་དུ་འགྲོ་དུས།
STT_MV0101_0069_501458_to_503063,དཔྱད་ཞིབ་བྱེད་སར་གཅིག་ཡོད་རེད་བ།  ,dpyad zhib byed sar gcig yod red ba/__,https://d38pmlk0v88drf.cloudfront.net/wav16k/STT_MV0101_0069_501458_to_503063.wav,STT_MV,3,34,1.605,wav16k/STT_MV0101_0069_501458_to_503063.wav,རྩད་ཞིབ་བྱེད་ས་ར་གཅིག་ཡོད་རེད་བ།
STT_PC0162_0167_885668_to_888676,ལྷག་པར་དུ་ཁེ་ས་དེ་རིང་ང་ཚོ་ཉིན་མ་གསུམ་མ་གཞི་འགྲོ་ཡོད་མ་རེད་དེ།  ,lhag par du khe sa de ring nga tsho nyin ma gsum ma gzhi 'gro yod ma red de/__,https://d38pmlk0v88drf.cloudfront.net/wav16k/STT_PC0162_0167_885668_to_888676.wav,STT_PC,3,64,3.008,wav16k/STT_PC0162_0167_885668_to_888676.wav,ལྷག་པར་དུ་ཁ་སང་དེ་རིང་ང་ཚོ་ཉི་མ་གསུམ་མ་ཤས་འགྲོ་ཡོད་མ་རེད་དེ།
STT_PC0162_0153_814966_to_818582,དེ་ནས་ཁོ་ཁོང་ཁྲོ་ཟེར་ཡ་དེ། དེ་འདྲས་མགྱོགས་པ་ཅིག་གིས་མེད་པ་བཟོ་ཐུབ་ཡ་ཅིག་ད་མ་རེད་བ།  ,de nas kho khong khro zer ya de/_de 'dras mgyogs pa cig gis med pa bzo thub ya cig da ma red ba/__,https://d38pmlk0v88drf.cloudfront.net/wav16k/STT_PC0162_0153_814966_to_818582.wav,STT_PC,3,84,3.616,wav16k/STT_PC0162_0153_814966_to_818582.wav,དེ་ནས་ཁོ་ཁོང་ཁྲོ་ཟེར་ཡ་དེ་དེ་འདྲས་མགྱོགས་པོ་ཅིག་གིས་མེད་པ་བཟོ་ཐུབ་ཡ་ཅིག་ད་མ་རེད་བ།
STT_PC0162_0155_821526_to_823702,སྐྱག་ལང་བཏང་བཞག་ན་ཁོ་རྩ་བ་ཉིད་ནས།  ,skyag lang btang bzhag na kho rtsa ba nyid nas/__,https://d38pmlk0v88drf.cloudfront.net/wav16k/STT_PC0162_0155_821526_to_823702.wav,STT_PC,3,35,2.176,wav16k/STT_PC0162_0155_821526_to_823702.wav,སྐྱག་ལང་བཏང་བཞག་ན། ཁོ་རྩ་བ་ཉིད་ནས།
STT_MV0101_0043_322350_to_324470,བྱས་ཙང་རང་དང་ཨའེ་ཧོས་ཀིས་ མིན།  ,byas tsang rang dang a'e hos kis _min/__,https://d38pmlk0v88drf.cloudfront.net/wav16k/STT_MV0101_0043_322350_to_324470.wav,STT_MV,3,32,2.12,wav16k/STT_MV0101_0043_322350_to_324470.wav,བྱས་ཙང་རང་དང་ཨའེ་ཧོས་ཀི། མིན།
STT_MV0101_0072_515294_to_521314,སྐུ་སྲུང་སྒྲན་ཀྲའོ་ངས་ལབ་པ་ནང་བཞིན་བཙོན་ཁང་ནང་བཅུག་ཡོད་རེད་བེ། སྐུ་ངོ་གིས་གསུང་པ་བཞིན་བསྒྲུབས་ཡོད།  ,sku srung sgran kra'o ngas lab pa nang bzhin btson khang nang bcug yod red be/_sku ngo gis gsung pa bzhin bsgrubs yod/__,https://d38pmlk0v88drf.cloudfront.net/wav16k/STT_MV0101_0072_515294_to_521314.wav,STT_MV,3,100,6.02,wav16k/STT_MV0101_0072_515294_to_521314.wav,སྐུ་སྲུང་སྒྲན་ཀྲའོ་ངས་ལབ་པ་ནང་བཞིན་བཙོན་ཁང་ནང་ལ་བཅུག་ཡོད་རེད་པེ། སྐུ་ངོ་གིས་གསུངས་པ་བཞིན་སྒྲུབ་ཡོད།
STT_MV0101_0073_521314_to_525503,བྱས་ན་འགྲིག་ཤག སྒྲན་ཀྲའོ་བློ་ཕམ་རུ་བཅུག་རྒྱུ་ཡོད་མ་རེད།  ,byas na 'grig shag_sgran kra'o blo pham ru bcug rgyu yod ma red/__,https://d38pmlk0v88drf.cloudfront.net/wav16k/STT_MV0101_0073_521314_to_525503.wav,STT_MV,3,57,4.189,wav16k/STT_MV0101_0073_521314_to_525503.wav,བྱས་ན་འགྲིག་ཤག སྒྲན་ཀྲའོ་བློ་ཕམ་པ་བཅུག་རྒྱུ་ཡོད་མ་རེད།
STT_MV0101_0025_192226_to_200400,ང་ད་ལྟ་བཙོན་ཁང་ལ་བསྡད་མི་འདུག་གེ ནང་ཀོང་གཡུད་ཧུའེ་རང་གི་བསད་མེད་པ། དེ་འདྲས་ཁུངས་ལུང་མེད་པ་རང་རེད། ཨའེ་ཧོས།  ,nga da lta btson khang la bsdad mi 'dug ge_nang kong g.yud hu'e rang gi bsad med pa/_de 'dras khungs lung med pa rang red/_a'e hos/__,https://d38pmlk0v88drf.cloudfront.net/wav16k/STT_MV0101_0025_192226_to_200400.wav,STT_MV,3,108,8.174,wav16k/STT_MV0101_0025_192226_to_200400.wav,ང་ད་ལྟ་བཙོན་ཁང་ལ་བསྡད་མི་འདུག་གེ ནང་ཀོང་གཡུད་ཧུའེ་རང་གིས་བསད་མེད་པ། དེ་འདྲས་འཁོར་ལོང་མེད་པ་རང་རེད། ཨའེ་ཧོས།
STT_MV0101_0026_200400_to_204909,རང་གི་གཅེན་པོ་སྒྲན་ཀྲའོ་ལ་བལྟ་སེ་བྱེད་པ་ལས་བསམ་འཆར་བཏོན་རྒྱུ་མེད་པ་བྱས་པ་ཡིན་པ།  ,rang gi gcen po sgran kra'o la blta se byed pa las bsam 'char bton rgyu med pa byas pa yin pa/__,https://d38pmlk0v88drf.cloudfront.net/wav16k/STT_MV0101_0026_200400_to_204909.wav,STT_MV,3,81,4.509,wav16k/STT_MV0101_0026_200400_to_204909.wav,རང་གིས་གཅེན་པོ་སྒྲན་ཀྲའོ་ལ་ལྟ་ཙི་བྱས་པ་ལས་བསམ་འཆར་བཏོན་རྒྱུ་མེད་པ་བྱས་པ་ཡིན་པ།
STT_AB00275_0941_5255196_to_5267687,དབུས་གཙང་། མདོ་ཁམས། རྒྱ་ནག ཁ་ཆེ་ཚུན་ཆད་ཀྱི་འབྱོར་པའི་ཁྱད་པར་རྨད་དུ་བྱུང་བ་དང་། ཉེ་བར་མཁོ་ཞིང་རྐྱེན་དུ་བབས་པའི་ཡོ་བྱད་ཀྱི་ཁྱད་པར་གང་ཅི་ཡང་རུང་བ་དག་ཐམས་ཅད་ ,dbus gtsang /_mdo khams/_rgya nag_kha che tshun chad kyi 'byor pa'i khyad par rmad du byung ba dang /_nye bar mkho zhing rkyen du babs pa'i yo byad kyi khyad par gang ci yang rung ba dag thams cad _,https://d38pmlk0v88drf.cloudfront.net/wav16k/STT_AB00275_0941_5255196_to_5267687.wav,STT_AB,3,154,12.491,wav16k/STT_AB00275_0941_5255196_to_5267687.wav,དབུས་གཙང་མདོ་ཁམས། རྒྱ་ནག་ཁ་ཆེ་ཚུན་ཆད་ཀྱི་འབྱོར་པའི་ཁྱད་པར་རྨད་དུ་བྱུང་བ་དང་། ཉེ་བར་མཁོ་ཞིང་རྐྱེན་དུ་བབས་པའི་ཡོ་བྱད་ཀྱི་ཁྱད་པར་གང་ཅི་ཡང་རུང་བ་དག་ཐམས་ཅད་
STT_AB00275_0942_5268353_to_5279539,དད་པའི་ཤུགས་ཀྱིས་ཡིད་ཀྱི་བརྟན་པ་ཉམས་པའི་སྐྱེ་བོ་མཆོག་དང་། གཙོ་བོ་དང་། དམན་པ་དང་། བར་མ་དག་གིས་དམ་པ་འདིའི་བསོད་ནམས་ཀྱི་ཞིང་ལ་དགེ་བའི་ལོ་ཏོག་བསྐྲུན་པའི་སླད་དུ་ ,dad pa'i shugs kyis yid kyi brtan pa nyams pa'i skye bo mchog dang /_gtso bo dang /_dman pa dang /_bar ma dag gis dam pa 'di'i bsod nams kyi zhing la dge ba'i lo tog bskrun pa'i slad du _,https://d38pmlk0v88drf.cloudfront.net/wav16k/STT_AB00275_0942_5268353_to_5279539.wav,STT_AB,3,157,11.186,wav16k/STT_AB00275_0942_5268353_to_5279539.wav,དད་པའི་ཤུགས་ཀྱིས་ཡིད་ཀྱི་བརྟན་པ་ཉམས་པའི་སྐྱེ་བོ་མཆོགས་དང་ གཙོ་བོ་དང་སྨན་པ་དང་བར་མ་དག་གིས་དམ་པ་འདིའི་བསོད་ནམས་ཀྱི་ཞིང་ལ་དགེ་བའི་ལོག་ཏོག་བསྐྲུན་པའི་སླད་དུ་
STT_AB00275_0947_5311134_to_5319598,ལན་ལ་རེ་བ་སོགས་ཀྱི་ཆེད་དུ་ཟང་ཟིང་གི་འདུ་འགོད་ལྷུར་ལེན་པས་དད་པས་བྱིན་པ་ཆུད་གཟོན་པར་བྱེད་པ་ལྟ་ཅི་སྨོས་ཀྱིས་ ,lan la re ba sogs kyi ched du zang zing gi 'du 'god lhur len pas dad pas byin pa chud gzon par byed pa lta ci smos kyis _,https://d38pmlk0v88drf.cloudfront.net/wav16k/STT_AB00275_0947_5311134_to_5319598.wav,STT_AB,3,106,8.464,wav16k/STT_AB00275_0947_5311134_to_5319598.wav,ལན་ལ་རེ་བ་སོགས་ཀྱི་ཆེད་དུ་ཟང་ཟིང་གི་འདུ་འགོད་ལྷུར་ལེན་པའི་དད་པས་བྱིན་པ་ཆུད་ཟོན་པར་བྱེད་པ་ལྟ་ཅི་སྨོས་ཀྱི།
STT_AB00275_0944_5291493_to_5300622,སྔོན་ཆད་བོད་ཀྱི་དགེ་བའི་བཤེས་གཉེན་ཕྱོགས་ཆེན་པོ་ཅན། གྲགས་པའི་བ་དན་གྱིས་མཛེས་པ་སུ་ལ་ཡང་དེ་ལྟ་བུ་བའི་གཏམ་བརྗོད་པ་མེད་དོ།  ,sngon chad bod kyi dge ba'i bshes gnyen phyogs chen po can/_grags pa'i ba dan gyis mdzes pa su la yang de lta bu ba'i gtam brjod pa med do/__,https://d38pmlk0v88drf.cloudfront.net/wav16k/STT_AB00275_0944_5291493_to_5300622.wav,STT_AB,3,119,9.129,wav16k/STT_AB00275_0944_5291493_to_5300622.wav,སྔོན་ཆད་བོད་ཀྱི་དགེ་བའི་བཤེས་གཉེན་ཕྱོགས་ཆེན་པོ་ཅན། གྲགས་པའི་བ་དན་གྱིས་མཛད་པ་སུ་ལ་ཡང་དེ་ལྟ་བུའི་གཏམ་བརྗོད་པ་མེད་དོ།
STT_PC0162_0160_769974_to_776198,ཨོ་ད་དེ་ཡག་པོ་ཞེ་དྲག་རེད། དེ་ཆུང་རུ་ལམ་སང་འགྲོ་གི་ཡང་མ་རེད་ལ། འགྲོ་དགོས་ཀི་མ་རེད། ལམ་སང་འགྲོ་ཐུབ་ཀི་ཡང་ ,o da de yag po zhe drag red/_de chung ru lam sang 'gro gi yang ma red la/_'gro dgos ki ma red/_lam sang 'gro thub ki yang _,https://d38pmlk0v88drf.cloudfront.net/wav16k/STT_PC0162_0160_769974_to_776198.wav,STT_PC,3,104,6.224,wav16k/STT_PC0162_0160_769974_to_776198.wav,ཨོ་ད་དེ་ཡག་པོ་ཞེ་དྲག་རེད། དེ་ཆུང་རུ་ལམ་སང་འགྲོ་གི་ཡང་མ་རེད་ལ་ འགྲོ་དགོས་ཀི་མ་རེད། ལམ་སང་འགྲོ་ཐུབ་ཀི་ཡང་
STT_PC0162_0164_866817_to_874889,ཁོ་རང་ཁོང་ཁྲོ་ཡིན་ན་འདྲ། འདོད་ཆགས་ཞེ་སྡང་ཡིན་ན་འདྲ། ཚང་མ་དེ་བདག་མེད་བཏང་ནས་ག་བ་ཡིན་ནས་ཁོ་རང་གིས་ག་རེ་བྱེད་ཟེ་ལབ་ནས་དེ་བྱེད་བཅུག་བཞག་པའི་རྒྱུ་མཚན་གིས་བསྟན་གི་ཡོད་རེད།  ,kho rang khong khro yin na 'dra/_'dod chags zhe sdang yin na 'dra/_tshang ma de bdag med btang nas ga ba yin nas kho rang gis ga re byed ze lab nas de byed bcug bzhag pa'i rgyu mtshan gis bstan gi yod red/__,https://d38pmlk0v88drf.cloudfront.net/wav16k/STT_PC0162_0164_866817_to_874889.wav,STT_PC,3,167,8.072,wav16k/STT_PC0162_0164_866817_to_874889.wav,ཁོ་རང་ཁོང་ཁྲོ་ཡིན་ན་འདྲ། འདོད་ཆགས་བཞེ་སྡོང་ཡིན་ན་འདྲ། ཚང་མ་དེ་བདག་མེད་བཏང་ནས་ག་བ་ཡིན་ནས་ཁོ་རང་གིས་ག་རེ་བྱས་ཟེ་ལབ་ན་དེ་བྱེད་བཅུག་བཞག་པའི་རྒྱུ་མཚན་གིས་བསྟེན་ཡོང་གོད་རེད།
STT_PC0162_0166_880228_to_883908,འགྱུར་བ་ཅིག་འགྲོ་བསྡད་ཀི་རེད། ཁོ་རང་ཡག་ཤོས་ཀི་འགྱུར་བ་ཅིག་འགྲོ་བསྡད་ཀི་ཡོདརེད། ལེགས་ཕྱོགས་ཀི་འགྱུར་བ་ཅིག ,'gyur ba cig 'gro bsdad ki red/_kho rang yag shos ki 'gyur ba cig 'gro bsdad ki yodared/_legs phyogs ki 'gyur ba cig_,https://d38pmlk0v88drf.cloudfront.net/wav16k/STT_PC0162_0166_880228_to_883908.wav,STT_PC,3,105,3.68,wav16k/STT_PC0162_0166_880228_to_883908.wav,འགྱུར་བ་ཅིག་འགྲོ་བསྡད་ཀི་རེད། ཁོ་རང་ཡག་ཤོས་ཀི་འགྱུར་བ་ཅིག་འགྲོ་བསྡད་ཀི་རེད། ལེགས་ཕྱོགས་ཀི་འགྱུར་བ་ཅིག
STT_MV0101_0041_313459_to_318886,དྲེ་ཧྲིང་ཁུངས་སྣེ་མེད་ཙང་ཉི་མ་གསུམ་ནང་ལག་དམར་བ་འཚོལ་མ་ཐུབ་པ་རང་གི་ཤེས་གསལ་རེད་པ།  ,dre hring khungs sne med tsang nyi ma gsum nang lag dmar ba 'tshol ma thub pa rang gi shes gsal red pa/__,https://d38pmlk0v88drf.cloudfront.net/wav16k/STT_MV0101_0041_313459_to_318886.wav,STT_MV,3,82,5.427,wav16k/STT_MV0101_0041_313459_to_318886.wav,ཁྲེང་ཧྲིང་གི་ཁུངས་སྣེ་མེད་ཙང་། ཉི་མ་གསུམ་ནང་ལ་ལག་དབར་བཙལ་མ་ཐུབ་པ་རང་གིས་ཤེས་གསལ་རེད་པ།
STT_PC0162_0173_924772_to_928516,ཁོང་ཁྲོ་ཟ་ཡོང་དུས། ངས་ཁོང་ཁྲོ་ཉུང་རུ་འགྲོ་གི་མི་འདུག་བསམ་རྒྱུ་ད་ཕར་ཙི་བཞག་ ,khong khro za yong dus/_ngas khong khro nyung ru 'gro gi mi 'dug bsam rgyu da phar tsi bzhag _,https://d38pmlk0v88drf.cloudfront.net/wav16k/STT_PC0162_0173_924772_to_928516.wav,STT_PC,3,75,3.744,wav16k/STT_PC0162_0173_924772_to_928516.wav,ཁོང་ཁྲོ་ཟ་ཡོང་དུས། ངས་ཁོང་ཁྲོ་ཉུང་རུ་འགྲོ་གི་མི་འདུག་བསམ་རྒྱུ་ད་ཕར་ཙི་བཞག
STT_PC0162_0174_928868_to_933828,ད་རུང་ངས་ཁོང་ཁྲོ་འདི་གིས་འདང་གི་མི་འདུག ངས་ཁོང་ཁྲོ་ཟ་དུས་སྐད་ཆ་ནག་པོ་བཤད་ཐུབ་མ་སོང་།  ,da rung ngas khong khro 'di gis 'dang gi mi 'dug_ngas khong khro za dus skad cha nag po bshad thub ma song /__,https://d38pmlk0v88drf.cloudfront.net/wav16k/STT_PC0162_0174_928868_to_933828.wav,STT_PC,3,86,4.96,wav16k/STT_PC0162_0174_928868_to_933828.wav,ད་རུང་ངས་ཁོང་ཁྲོ་འདི་གིས་འདང་གི་མི་འདུག ངས་ཁོང་ཁྲོ་ཟ་དུས་སྐད་ཆ་ནག་པོ་བཤད་ཐུབ་མ་སོང་།
STT_PC0162_0178_964218_to_966906,འགྱུར་བ་ཅིག་འགྲོ་ས་རེད་ཨ་བསམ་དགོས་ཀི་རེད། རང་གིས་རང་།  ,'gyur ba cig 'gro sa red a bsam dgos ki red/_rang gis rang /__,https://d38pmlk0v88drf.cloudfront.net/wav16k/STT_PC0162_0178_964218_to_966906.wav,STT_PC,3,55,2.688,wav16k/STT_PC0162_0178_964218_to_966906.wav,འགྱུར་བ་ཅིག་འགྲོ་ས་རེད་ཨ་བསམ་དགོས་ཀི་རེད། རང་གིས་རང་།
STT_PC0162_0156_824758_to_830358,སྐར་མ་གཅིག་མ་འགྲོ་པ་མ་ཚད་པས། ཉིན་མ་རེ་རེ་བཞིན་དུ་དེ་ནས་ཁོ་མང་རུ་མང་རུ་མང་རུ་མང་རུ་མང་རུ་ཕྱིན།  ,skar ma gcig ma 'gro pa ma tshad pas/_nyin ma re re bzhin du de nas kho mang ru mang ru mang ru mang ru mang ru phyin/__,https://d38pmlk0v88drf.cloudfront.net/wav16k/STT_PC0162_0156_824758_to_830358.wav,STT_PC,3,95,5.6,wav16k/STT_PC0162_0156_824758_to_830358.wav,སྐར་མ་གཅིག་མ་འགྲོ་བར་མ་ཚད་པའི། ཉི་མ་རེ་རེ་བཞིན་དུ་དེ་ནས་ཁོ་མང་རུ་མང་རུ་མང་རུ་མང་རུ་ཕྱིན།
STT_MV0101_0042_318886_to_322350,རེ་བ་མེད་ནས་ཚོད་ལྟ་གཅིག་བྱེད་དགོས་རེད་པ།  ,re ba med nas tshod lta gcig byed dgos red pa/__,https://d38pmlk0v88drf.cloudfront.net/wav16k/STT_MV0101_0042_318886_to_322350.wav,STT_MV,3,42,3.464,wav16k/STT_MV0101_0042_318886_to_322350.wav,རེ་བ་མེད་ནས་ཚོད་ལྟ་གཅིག་བྱེད་དགོས་རེད་པ།
STT_AB00260_0156_1209343_to_1217252,ང་ཚོར་ལག་ལས་བྱེད་པའི་དུས་ཚོད་ཆེད་མངགས་མེད་ཙང་། ངལ་རྩོལ་གྱི་བར་གསེང་ལ་ཡ་ལག་ལས་མ་བྱས་ན་ང་ཚོ་ཚང་མ་གྱོན་ཆས་གྱོན་དགོས་རེད། ཅེས་བཤད་པས་ ,nga tshor lag las byed pa'i dus tshod ched mngags med tsang /_ngal rtsol gyi bar gseng la ya lag las ma byas na nga tsho tshang ma gyon chas gyon dgos red/_ces bshad pas _,https://d38pmlk0v88drf.cloudfront.net/wav16k/STT_AB00260_0156_1209343_to_1217252.wav,STT_AB,3,130,7.909,wav16k/STT_AB00260_0156_1209343_to_1217252.wav,ང་ཚོ་ལག་ལས་བྱེད་པའི་དུས་ཚོད་ཆེད་མངགས་མེད་ཙང་ ངལ་རྩོལ་གྱི་བར་གསེང་ལ་ཡ་ལག་ལས་མ་བྱས་ན་ང་ཚོ་ཚང་མ་གྱོན་བཆས་གྱོན་དགོས་རེད་ཅེས་བཤད་པས་
